{
  "agent_calls": 10,
  "cost_usd": 0.0,
  "critical_path": [
    "T-0001",
    "T-0002",
    "T-0003",
    "T-0004"
  ],
  "events_count": 63,
  "files_changed": 3,
  "finished_at": "2026-01-01T00:00:00.700000+00:00",
  "interventions": {
    "false_positive_guarded": true,
    "total": 0
  },
  "per_task": [
    {
      "attempts": 1,
      "duration_ms": 80,
      "kind": "research",
      "review_rejected": false,
      "status": "done",
      "task_id": "T-0001",
      "tokens": 1370
    },
    {
      "attempts": 1,
      "duration_ms": 90,
      "kind": "implementation",
      "review_rejected": false,
      "status": "done",
      "task_id": "T-0002",
      "tokens": 1528
    },
    {
      "attempts": 1,
      "duration_ms": 90,
      "kind": "test",
      "review_rejected": false,
      "status": "done",
      "task_id": "T-0003",
      "tokens": 1520
    },
    {
      "attempts": 1,
      "duration_ms": 90,
      "kind": "integration",
      "review_rejected": false,
      "status": "done",
      "task_id": "T-0004",
      "tokens": 1570
    }
  ],
  "retries": {
    "by_task": {},
    "total": 0
  },
  "reviews": {
    "rejected": 0,
    "rework_rounds": 0,
    "total": 4
  },
  "run_id": "RUN-SELFHOST",
  "schema_version": "1",
  "started_at": "2026-01-01T00:00:00.200000+00:00",
  "status": "DONE",
  "success_rate": 1.0,
  "tasks": {
    "cancelled": 0,
    "done": 4,
    "failed": 0,
    "max_depth": 0,
    "quarantined": 0,
    "split_parents": 0,
    "total": 4
  },
  "tokens": {
    "budget_limit": 200000,
    "input": 6545,
    "output": 1427,
    "pressure": 0.0399,
    "total": 7972
  },
  "wall_ms": 500
}
